{
  "schema_version": "1.0.0",
  "id": "id-example-0001",
  "name": "name-example-0001",
  "version": "1.0.0",
  "released_at": "2026-07-26T12:00:00Z",
  "license": {},
  "records": 0,
  "splits": {},
  "sources": [
    {}
  ],
  "review": {},
  "contamination_report": {
    "schema_version": "1.0.0",
    "id": "id-example-0001",
    "kind": "document",
    "uri": "https://example.org/artifact",
    "digest": "sha256:aaaaaaaaaaaaaaaaaaaaaaaaaaaaaaaaaaaaaaaaaaaaaaaaaaaaaaaaaaaaaaaa",
    "classification": "public",
    "created_at": "2026-07-26T12:00:00Z",
    "source_system": "source_system-example-0001"
  },
  "artifacts": [
    {
      "schema_version": "1.0.0",
      "id": "id-example-0001",
      "kind": "document",
      "uri": "https://example.org/artifact",
      "digest": "sha256:aaaaaaaaaaaaaaaaaaaaaaaaaaaaaaaaaaaaaaaaaaaaaaaaaaaaaaaaaaaaaaaa",
      "classification": "public",
      "created_at": "2026-07-26T12:00:00Z",
      "source_system": "source_system-example-0001"
    }
  ],
  "manifest_digest": "sha256:aaaaaaaaaaaaaaaaaaaaaaaaaaaaaaaaaaaaaaaaaaaaaaaaaaaaaaaaaaaaaaaa"
}
