{
  "schema_version": "1.0.0",
  "id": "atticusbench-public-seed",
  "name": "AtticusBench Public Seed",
  "version": "0.1.1",
  "released_at": "2026-09-18T00:00:00Z",
  "license": {
    "id": "Apache-2.0",
    "uri": "repo://LICENSE",
    "content_rights": "synthetic, original to this repository"
  },
  "records": 33,
  "splits": {
    "public-test": 33
  },
  "sources": [
    {
      "id": "hand-authored-synthetic",
      "description": "Hand-authored synthetic cases and fixtures. No model generated a case, no donated trace was used, and no real record appears.",
      "records": 33,
      "rights": "synthetic",
      "corpus_digest": "sha256:89c0352949b0cef9ab59e00014da98fbad6aaccacf7eb60c56978821381b1fb7"
    }
  ],
  "review": {
    "dual_human_review": 13,
    "single_human_review": 20,
    "automated_checks": [
      "schema validation",
      "cross-document consistency",
      "content digest verification",
      "duplication audit",
      "reference-plan execution against every case"
    ],
    "caveat": "One person authored and reviewed this seed. The dual-review class records the specification's requirement, not two independent sign-offs."
  },
  "contamination_report": {
    "schema_version": "1.0.0",
    "id": "atticusbench-public-seed-contamination",
    "kind": "report",
    "uri": "repo://datasets/atticusbench/release/contamination-report.json",
    "digest": "sha256:4aa33462ef5f5758bec9638da15dcf17545576820ba4b7cf76395388ea50a263",
    "classification": "public",
    "media_type": "application/json",
    "title": "Contamination and duplication report",
    "created_at": "2026-09-18T00:00:00Z",
    "source_system": "dewitt-research-lab"
  },
  "artifacts": [
    {
      "schema_version": "1.0.0",
      "id": "atticusbench-public-seed-cases",
      "kind": "dataset",
      "uri": "repo://datasets/atticusbench/release/case-index.json",
      "digest": "sha256:6a0c01203a74a8b1d651b5960c46b0b3642d57ff71f798cd083bde193fa127a7",
      "classification": "public",
      "media_type": "application/json",
      "title": "Case and fixture digest index",
      "created_at": "2026-09-18T00:00:00Z",
      "source_system": "dewitt-research-lab"
    },
    {
      "schema_version": "1.0.0",
      "id": "atticusbench-public-seed-dataset-card",
      "kind": "document",
      "uri": "repo://datasets/atticusbench/docs/DATASET_CARD.md",
      "digest": "sha256:1ea7fb43afe7cbff85389cdaeed352f75620dfcf920ba10878a09bc4f226939a",
      "classification": "public",
      "media_type": "text/markdown",
      "title": "Dataset card",
      "created_at": "2026-09-18T00:00:00Z",
      "source_system": "dewitt-research-lab"
    },
    {
      "schema_version": "1.0.0",
      "id": "atticusbench-public-seed-case-schema",
      "kind": "document",
      "uri": "repo://datasets/atticusbench/schemas/atticusbench-case.schema.json",
      "digest": "sha256:6721debd5b2dc8c076468ece03687308a12f30760a7be71360a80e7e804da034",
      "classification": "public",
      "media_type": "application/schema+json",
      "title": "Case schema",
      "created_at": "2026-09-18T00:00:00Z",
      "source_system": "dewitt-research-lab"
    },
    {
      "schema_version": "1.0.0",
      "id": "atticusbench-public-seed-fixture-schema",
      "kind": "document",
      "uri": "repo://datasets/atticusbench/schemas/atticusbench-fixture.schema.json",
      "digest": "sha256:c563cede0da67b318ecd96f2f8f06133473579dca1536aeaaf5d122efb3de5dd",
      "classification": "public",
      "media_type": "application/schema+json",
      "title": "Fixture schema",
      "created_at": "2026-09-18T00:00:00Z",
      "source_system": "dewitt-research-lab"
    },
    {
      "schema_version": "1.0.0",
      "id": "atticusbench-public-seed-baseline-results",
      "kind": "report",
      "uri": "repo://runs/atticusbench/results.json",
      "digest": "sha256:1a0f0ab589daba89043c2bb267f3c10896ba663c61bf42baafc76dae0456c052",
      "classification": "public",
      "media_type": "application/json",
      "title": "Deterministic baseline results",
      "created_at": "2026-09-18T00:00:00Z",
      "source_system": "dewitt-research-lab"
    }
  ],
  "manifest_digest": "sha256:a15700f4cf319b9be04daac80a71b4ccce7a2ddfb7467ee1c2b3a0c5784ba9fb"
}
